{
  "schema_version": "smartweights/v1",
  "name": "Eldrae Safety Guard SmartWeights",
  "version": "0.1.0",
  "kind": "knowledge_snapshot",
  "created_at": "2026-04-20T19:05:00+00:00",
  "identity": {
    "assistant": "Eldrae",
    "role": "safe execution policy guard"
  },
  "base": {
    "runtime_model": "qwen2.5-coder:3b",
    "training_model": "Qwen/Qwen2.5-Coder-3B-Instruct",
    "frozen": true
  },
  "rft_space": {
    "family": "RFTMW",
    "encoding": "prompt_overlay",
    "base_tensor_mutation": "none"
  },
  "artifacts": [
    {
      "path": "smartweights/packs/eldrae-safety-guard/system_prompt_enhancement.md",
      "optional": false,
      "present": true,
      "kind": "prompt_overlay"
    }
  ],
  "training": {
    "datasets": [],
    "reports": [],
    "guardrails": "require explicit confirmation for risky/destructive operations"
  },
  "capabilities": [
    "safety_policy",
    "risk_reduction",
    "integrity_protection"
  ],
  "safety": {
    "base_weight_mutation": "forbidden",
    "loads_as_overlay": true,
    "requires_manifest_validation": true,
    "destructive_actions": "requires_user_approval",
    "network_access": "off_by_default",
    "allowed_write_roots": [
      "smartweights/packs",
      "logs"
    ]
  },
  "notes": "Safety overlay that enforces truthful execution claims and conservative defaults."
}
