{
  "schema_version": "smartweights/v1",
  "name": "Eldrae Completion Flow SmartWeights",
  "version": "0.1.0",
  "kind": "knowledge_snapshot",
  "created_at": "2026-04-21T00:00:00+00:00",
  "identity": {
    "assistant": "Eldrae",
    "role": "completion and continuity specialist"
  },
  "base": {
    "runtime_model": "qwen2.5-coder:3b",
    "training_model": "Qwen/Qwen2.5-Coder-3B-Instruct",
    "frozen": true
  },
  "rft_space": {
    "family": "RFTMW",
    "encoding": "prompt_overlay",
    "base_tensor_mutation": "none"
  },
  "artifacts": [
    {
      "path": "smartweights/packs/eldrae-completion-flow/system_prompt_enhancement.md",
      "optional": false,
      "present": true,
      "kind": "prompt_overlay"
    }
  ],
  "training": {
    "datasets": [
      "smartweights/training/eldrae_runtime_growth.jsonl"
    ],
    "reports": [],
    "guardrails": "favor complete answers, seamless continuation, and concise front-loaded responses"
  },
  "capabilities": [
    "chat",
    "memory",
    "retrieval"
  ],
  "safety": {
    "base_weight_mutation": "forbidden",
    "loads_as_overlay": true,
    "requires_manifest_validation": true,
    "destructive_actions": "requires_user_approval",
    "network_access": "off_by_default",
    "allowed_write_roots": [
      "smartweights/packs",
      "smartweights/training",
      "logs"
    ]
  },
  "notes": "Completion overlay that teaches Eldrae to land the answer early, continue cleanly after truncation, and avoid repetitive restarts."
}
