{
  "schema_version": "smartweights/v1",
  "name": "Eldrae Tool Router SmartWeights",
  "version": "0.1.0",
  "kind": "knowledge_snapshot",
  "created_at": "2026-04-21T00:00:00+00:00",
  "identity": {
    "assistant": "Eldrae",
    "role": "local tool routing specialist"
  },
  "base": {
    "runtime_model": "qwen2.5-coder:3b",
    "training_model": "Qwen/Qwen2.5-Coder-3B-Instruct",
    "frozen": true
  },
  "rft_space": {
    "family": "RFTMW",
    "encoding": "prompt_overlay",
    "base_tensor_mutation": "none"
  },
  "artifacts": [
    {
      "path": "smartweights/packs/eldrae-tool-router/system_prompt_enhancement.md",
      "optional": false,
      "present": true,
      "kind": "prompt_overlay"
    }
  ],
  "training": {
    "datasets": [
      "smartweights/training/eldrae_runtime_growth.jsonl"
    ],
    "reports": [],
    "guardrails": "prefer local tools, preserve user details, and keep tool calls explicit and scoped"
  },
  "capabilities": [
    "chat",
    "tool_planning",
    "visual_programs"
  ],
  "safety": {
    "base_weight_mutation": "forbidden",
    "loads_as_overlay": true,
    "requires_manifest_validation": true,
    "destructive_actions": "requires_user_approval",
    "network_access": "off_by_default",
    "allowed_write_roots": [
      "smartweights/packs",
      "smartweights/training",
      "generated/images",
      "logs"
    ]
  },
  "notes": "Tool-routing overlay that sharpens Eldrae's local image and workflow invocation behavior without claiming native pixel generation."
}
